""	"response_component"	"curation_date"	"cohort"	"age_min"	"age_max"	"age_units"	"number_subjects"	"tissue_type"	"tissue_type_term_id"	"response_component_original"	"is_model"	"response_behavior_type"	"response_behavior"	"comparison"	"baseline_time_event"	"time_point"	"time_point_units"	"exposure_material"	"exposure_material_id"	"additional_exposure_material"	"target_pathogen"	"target_pathogen_taxonid"	"vaccine_year"	"adjuvant"	"route"	"scheduling"	"publication_reference_id"	"publication_date"	"publication_reference_url"	"signature_source"	"signature_source_url"	"comments"	"response_comp_orig_cnt"	"response_comp_cnt"	"sig_subm_id"	"sig_row_id"	"row_key"
""	"P4HB; PRDX6; RAB11A; USP9X; SH3BGRL; LRP10; RHEB; RPA1; RAE1; SEC23B; IL13RA1; GNG10; NUP133; CSTF1; PPP2R2A; UBE2K; HSPA13; CDC23; BTBD3; CREBZF; MEF2D; TCTA; AKAP11; NUP98; MTF2; EPHA2; CUL5; MAP4K5; CPT1A; FDX1; DPP4; ZKSCAN5; USP46; THBD; SLC9A6; NDST2; MORC2; ZNF212; RFC4; ZBTB43; GRK3; EML2; GAS1; SCN3B; IL11RA; NAIP; CIB2; ASNS; SGCB; EGR2; BTN2A2; ALG13; PIP5K1B; DUS4L; ARSB; ZKSCAN7; CFP; CPSF4; GLMN; SEPTIN9; TLR6; P2RY1; GIPC1; BCS1L; NCOR2; SPIN2A; MID2; RASA4B; RASA4; ATP5MG; H1-0; UQCRFS1; FBXL5; DNAJB6; JAG1; PRPF4; OSBPL2; GSTZ1; MRPL9; SOCS5; CES2; CXCL2; EWSR1; ZNF589; LILRB4; HSPA1L; GNMT; MAPK14; DDX49; POMZP3; TLK1; ESR2; CD84; MAPRE2; PTEN; BDH1; KMT2A; PIK3R1; SPRED2; PTPN11; TPM2; PHLPP1; CKAP5; RRP1B; TAF6L; KNOP1; SACS; CENPS; RPL37A; COPS6; PRKCI; ICAM2; DNAJC24; PNPLA2; SAT1; YPEL1; MYCL; GPX3; FH; MTMR6; BCAT1; IFI44; NOP14; WDR43; SMG6; API5; RXRB; YOD1; SLC8A2; PDE4B; NDUFA5; NR3C1; GK; B3GALT2; NFATC2IP; GMPR2; PRC1; DCTN4; SLC12A7; DBNDD2; SYS1; SYS1-DBNDD2; ERGIC2; SPATA20; HERC1; TTC4; KLF11; SDAD1; EIF4ENIF1; RNF138; DSE; KLC2; METTL22; ZFP64; TPRKB; MORC4; FASTKD3; NABP1; ARMCX5; MTERF3; COQ10B; LRFN4; WWC3; ZNF3; FBXO38; YBX2; TRIM36; ANKFY1; LUC7L2; ENTPD7; NANOG; RBM12B-AS1; UEVLD; SLC38A4; FRAS1; STXBP6; CSAD; PAXBP1; BRCC3; MPIG6B; CCNL2; USP3; LONP2; N4BP1; FAM131A; CDK17; RETREG2; AMIGO2; WDR13; CEP63; RGS14; MADD; GNA11; GNL3L; ELMO2; CACFD1"	""	""	"18"	"50"	"years"	""	"plasmacytoid dendritic cell"	"CL:0000784"	"P4HB; PRDX6; RAB11A; USP9X; SH3BGRL; LRP10; RHEB; RPA1; RAE1; SEC23B; IL13RA1; GNG10; NUP133; CSTF1; PPP2R2A; UBE2K; HSPA13; CDC23; BTBD3; CREBZF; MEF2D; TCTA; AKAP11; NUP98; MTF2; EPHA2; CUL5; MAP4K5; CPT1A; FDX1; DPP4; ZKSCAN5; USP46; THBD; SLC9A6; NDST2; MORC2; ZNF212; RFC4; ZBTB43; ADRBK2; EML2; GAS1; SCN3B; IL11RA; NAIP; CIB2; ASNS; SGCB; EGR2; BTN2A2; ALG13; PIP5K1B; DUS4L; ARSB; ZNF167; CFP; CPSF4; GLMN; SEPT9; TLR6; P2RY1; GIPC1; BCS1L; NCOR2; SPIN2A; MID2; RASA4B; RASA4; ATP5L; H1F0; UQCRFS1; FBXL5; DNAJB6; JAG1; PRPF4; OSBPL2; GSTZ1; MRPL9; SOCS5; CES2; CXCL2; EWSR1; ZNF589; LILRB4; HSPA1L; GNMT; MAPK14; DDX49; POMZP3; TLK1; ESR2; CD84; MAPRE2; PTEN; BDH1; KMT2A; PIK3R1; SPRED2; PTPN11; TPM2; PHLPP1; CKAP5; RRP1B; TAF6L; C16orf88; SACS; APITD1; RPL37A; COPS6; PRKCI; ICAM2; DNAJC24; PNPLA2; SAT1; YPEL1; MYCL1; GPX3; FH; MTMR6; BCAT1; IFI44; NOP14; WDR43; SMG6; API5; RXRB; YOD1; SLC8A2; PDE4B; NDUFA5; NR3C1; GK; B3GALT2; NFATC2IP; GMPR2; PRC1; DCTN4; SLC12A7; DBNDD2; SYS1; SYS1-DBNDD2; ERGIC2; SPATA20; HERC1; TTC4; KLF11; SDAD1; EIF4ENIF1; RNF138; DSE; KLC2; C16orf68; ZFP64; TPRKB; MORC4; FASTKD3; OBFC2A; ARMCX5; MTERFD1; COQ10B; LRFN4; WWC3; ZNF3; FBXO38; YBX2; TRIM36; ANKFY1; LUC7L2; ENTPD7; NANOG; RBM12B-AS1; UEVLD; SLC38A4; FRAS1; STXBP6; CSAD; GCFC1; BRCC3; MPIG6B; CCNL2; USP3; LONP2; N4BP1; FAM131A; CDK17; FAM134A; AMIGO2; WDR13; CEP63; RGS14; MADD; GNA11; GNL3L; ELMO2; C9orf7"	"N"	"gene expression"	"down"	"7d vs 0d"	"time of vaccination"	"7"	"days"	"Fluarix; Fluvirin"	"VO:0000045; VO:0000046"	""	"Influenza A virus (A/Solomon Islands/3/2006(H1N1)); Influenza A virus (A/Wisconsin/67/2005(H3N2)); Influenza B virus (B/Malaysia/2506/2004); Influenza A virus (A/Brisbane/59/2007(H1N1)); Influenza A virus (A/Brisbane/10/2007(H3N2)); Influenza B virus (B/Florida/4/2006); Influenza B virus (B/Brisbane/60/2008)"	"464623; 393902; 464417; 504904; 476294; 461739; 604436"	"2007, 2008, 2009"	""	""	""	"21743478"	"2011"	"https://www.ncbi.nlm.nih.gov/pubmed/?term=21743478"	"Supplementary Table 2a: TIV-pDC"	"https://www.ncbi.nlm.nih.gov/pmc/articles/PMC3140559/bin/NIHMS301940-supplement-3.xlsx"	""	"199"	"196"	"29"	"306"	"21743478_29_306"
""	"UBA7; ZPR1; RAD21; GLO1; NCOR1; THBS1; JUN; SAR1A; KDM5B; MARCKS; EGR1; ARIH1; SPEN; SEC14L1; LIMK2; GGPS1; TCOF1; MYC; CRIM1; CRABP2; IRF3; PALM2AKAP2; SFSWAP; HEXIM1; RALBP1; SMAD2; KIF2A; GABBR1; TIMP2; BRD3OS; ZNF148; STX5; ARRB2; CCNA2; KLF9; TFDP2; ALDH5A1; SULT1A1; CTSO; ELP4; FOXO3; RRP9; SIK3; ZNF593; S100A2; PMAIP1; APEX2; CLUAP1; CDC25A; COL9A3; PTGS2; ZBED4; EEA1; CARD8; AMMECR1; PFN2; NMB; SCO2; AIFM1; CD86; NOLC1; ADAM28; GABPB1; CD180; EYA3; RASA2; SP4; PRKCA; NIPBL; TNIP1; CEP135; GADD45B; SLC4A7; PSEN1; LAIR1; CBLB; SLC12A3; APLP2; ATP5MC2; DNAJB6; TMEM135; PTK2; PAK2; ZMYND8; MEF2C; TASOR; CDC42EP3; TNFRSF10B; HBS1L; SCAF11; TNFSF12-TNFSF13; TNFSF13; CFLAR; IL10RB; SULT1A3; SULT1A4; SLC35D1; TMPO; CD69; PSME3; ITSN2; CTSZ; SF1; STX11; MTSS1; TP53I3; LILRA1; LGALS8; SIGLEC6; BACH1; CNOT4; PRPF4B; DEDD; RGPD5; RGPD6; RGPD8; DPP4; MAP3K7; APAF1; IGH; IGHA1; IGHA2; IGHD; IGHG1; IGHG3; IGHG4; IGHM; IGHV3-23; BLVRA; EPB41L3; BAX; IPO5; ZFP36L1; SZRD1; UBXN4; RHOB; KPNA6; RHOQ; POM121; POM121C; LPIN1; NRP1; FEM1B; TRIM33; WDFY3; WASHC4; TMCC1; WSB1; IQGAP1; PCBP2; HSD17B8; HIPK3; RABGGTB; SRSF11; RBMX; DHX34; SRRT; PDE4DIP; ATP10A; H2AC18; H2AC19; KRAS; NEAT1; IPCEF1; EIF4A1; CD40; KRT86; ATF7IP; SLC2A14; SLC2A3; ISG20L2; MTAP; PTPN12; TLE4; DLG1; VPS26C; KYNU; POLR2A; CD22; IL6R; PPIA; GNL3L; AKAP6; TLE5; PIH1D1; TIMM10B; HGSNAT; ARNT; DHX40; OAS3; TMUB2; PLBD1; TRPS1; HECTD3; STX17; CENPO; ZMAT3; TMEM260; CDHR5; MRPS18C; KLHL28; CAMSAP1; FAR2; TAOK3; SLC17A5; COTL1; GPR52; SNX27; TNPO2; STX16; F11R; RALGAPB; LRRC37A2; DENND10; ADCK2; NTM; GOLGA2; RBM12B; ZGPAT; CALML4"	""	""	"18"	"50"	"years"	""	"plasmacytoid dendritic cell"	"CL:0000784"	"UBA7; ZNF259; RAD21; GLO1; NCOR1; THBS1; JUN; SAR1A; KDM5B; MARCKS; EGR1; ARIH1; SPEN; SEC14L1; LIMK2; GGPS1; TCOF1; MYC; CRIM1; CRABP2; IRF3; AKAP2; PALM2-AKAP2; SFRS8; HEXIM1; RALBP1; SMAD2; KIF2A; GABBR1; TIMP2; BRD3OS; ZNF148; STX5; ARRB2; CCNA2; KLF9; TFDP2; ALDH5A1; SULT1A1; CTSO; ELP4; FOXO3; RRP9; SIK3; ZNF593; S100A2; PMAIP1; APEX2; CLUAP1; CDC25A; COL9A3; PTGS2; ZBED4; EEA1; CARD8; AMMECR1; PFN2; NMB; SCO2; AIFM1; CD86; NOLC1; ADAM28; GABPB1; CD180; EYA3; RASA2; SP4; PRKCA; NIPBL; TNIP1; CEP135; GADD45B; SLC4A7; PSEN1; LAIR1; CBLB; SLC12A3; APLP2; ATP5G2; DNAJB6; TMEM135; PTK2; PAK2; ZMYND8; MEF2C; FAM208A; CDC42EP3; TNFRSF10B; HBS1L; SFRS2IP; TNFSF12-TNFSF13; TNFSF13; CFLAR; IL10RB; SULT1A3; SULT1A4; SLC35D1; TMPO; CD69; PSME3; ITSN2; CTSZ; SF1; STX11; MTSS1; TP53I3; LILRA1; LGALS8; SIGLEC6; BACH1; CNOT4; PRPF4B; DEDD; RGPD5; RGPD6; RGPD8; DPP4; MAP3K7; APAF1; IGH; IGHA1; IGHA2; IGHD; IGHG1; IGHG3; IGHG4; IGHM; IGHV3-23; BLVRA; EPB41L3; BAX; IPO5; ZFP36L1; C1orf144; UBXN4; RHOB; KPNA6; RHOQ; POM121; POM121C; LPIN1; NRP1; FEM1B; TRIM33; WDFY3; WASHC4; TMCC1; WSB1; IQGAP1; PCBP2; HSD17B8; HIPK3; RABGGTB; SFRS11; RBMX; DHX34; SRRT; PDE4DIP; ATP10A; HIST2H2AA3; HIST2H2AA4; KRAS; NEAT1; IPCEF1; EIF4A1; CD40; KRT86; ATF7IP; SLC2A14; SLC2A3; ISG20L2; MTAP; PTPN12; TLE4; DLG1; DSCR3; KYNU; POLR2A; CD22; IL6R; PPIA; GNL3L; AKAP6; AES; PIH1D1; FXC1; HGSNAT; ARNT; DHX40; OAS3; TMUB2; PLBD1; TRPS1; HECTD3; STX17; CENPO; ZMAT3; C14orf101; CDHR5; MRPS18C; KLHL28; CAMSAP1; FAR2; TAOK3; SLC17A5; COTL1; GPR52; SNX27; TNPO2; STX16; F11R; RALGAPB; LRRC37A2; FAM45A; ADCK2; NTM; GOLGA2; RBM12B; ZGPAT; CALML4"	"N"	"gene expression"	"up"	"7d vs 0d"	"time of vaccination"	"7"	"days"	"Fluarix; Fluvirin"	"VO:0000045; VO:0000046"	""	"Influenza A virus (A/Solomon Islands/3/2006(H1N1)); Influenza A virus (A/Wisconsin/67/2005(H3N2)); Influenza B virus (B/Malaysia/2506/2004); Influenza A virus (A/Brisbane/59/2007(H1N1)); Influenza A virus (A/Brisbane/10/2007(H3N2)); Influenza B virus (B/Florida/4/2006); Influenza B virus (B/Brisbane/60/2008)"	"464623; 393902; 464417; 504904; 476294; 461739; 604436"	"2007, 2008, 2009"	""	""	""	"21743478"	"2011"	"https://www.ncbi.nlm.nih.gov/pubmed/?term=21743478"	"Supplementary Table 2a: TIV-pDC"	"https://www.ncbi.nlm.nih.gov/pmc/articles/PMC3140559/bin/NIHMS301940-supplement-3.xlsx"	""	"236"	"221"	"30"	"307"	"21743478_30_307"
""	"PHB1; ACTR1A; GNB1; LAMC1; FKBP4; IPO7; USP9X; BHLHE40; SELENOW; WSB1; CACYBP; SOX4; ETF1; TPD52; ACIN1; SAFB; SPEN; LANCL1; SDHD; MTMR3; FBXO28; ELP1; BCL7B; APPBP2; GTF2E2; ITM2A; PPP2R1B; DYRK2; MEF2D; TGFB1; TLE1; SCAF8; ARHGEF9; SLC35A1; SLC25A12; MTF2; PSD3; HES1; SORL1; LSM1; TFDP2; INPP5F; UTP14C; COBLL1; PCNT; TMOD1; TDG; DMXL1; CD302; WIPI1; SLC31A1; STK19; FOXO3; AMT; NF1; KHSRP; ELMO1; PARM1; PANX1; MGMT; HUS1; PEX11A; IL6; NR3C2; KMO; PDZK1; ZBTB20; SMAD3; DNAJC8; DIAPH2; NCOA2; AFF3; ZNF107; DDX18; TCP11L1; TRPC1; WASL; ZNF264; RNH1; LRRC37A3; ZNF35; CXCR5; TGM4; NDRG2; OAS2; F11; CUBN; FGF18; HGFAC; ASS1; NOX1; SEPTIN9; SNRK; BTN3A1; RAB28; DGKQ; OGT; ARID1A; PAX3; PSEN1; RBPJ; TNFRSF4; MYO7A; EVI5; RCAN1; TBPL1; PER2; CD164; CAVIN1; NEU1; FADS1; COPS7A; NHP2; USP10; MPDU1; CDC42EP3; NECAP1; IFI35; RBPMS; PRUNE1; SLC1A4; KPNA4; SLC19A2; CORO2B; NPAT; CREM; GPD2; RAPGEF3; MAPK13; LAMA5; PCMT1; MTSS1; ANKMY1; NFATC3; KLHL20; PFKM; CROCCP2; NFYC; CFLAR; FGFR2; SC5D; NFIB; HOPX; PNN; WIPF2; DHX9; CYFIP1; RNF187; AGRN; FEM1B; RRAS2; WWP1; DHX29; PHLPP1; PAPOLA; ARHGAP19; NFATC2IP; JAM3; DICER1; MAPK8IP1; OLFML2A; TAF6L; DIDO1; RPL28; PPM1B; TUBGCP4; UBE3A; IPW; SNED1; ING2; HIPK2; CLMN; RBFOX2; TTBK2; ID2; ID2B; SPON1; VGLL4; TBC1D1; TMSB15B; SHMT2; YLPM1; N4BP2L2; TRIM33; SFT2D2; KCTD20; SPTBN1; USP34; RXRB; FMO5; KIAA1614; LYST; BTN2A1; GTF2IRD2; GTF2IRD2B; TUBGCP3; NCLN; SKIL; ZNF81; DAAM1; ABCA1; DKC1; SMPD1; NR4A2; DCAF11; KRT3; SCUBE3; EIF4G2; PDAP1; ANGEL2; NAA50; USP39; TNS3; BACE2; SSBP3; MKRN2; TIMM23; TIMM23B; CFAP298; CCDC25; UBE2O; MCTS1; OXR1; FYCO1; AGO1; HERC1; GALNT7; PGLS; TOR3A; ANAPC1; SUV39H1; DGCR8; SNX24; CENPM; SLC8B1; SLC35F2; PPP1R13L; PNKP; PAM16; SLC35E3; MIS18A; NUP43; GALNT11; ZNF576; AGO4; FASTKD3; ZDHHC14; MED31; PALS1; CLN8; USE1; ANKRD11; TMEM127; PALB2; DUOX1; ZMAT3; RBM41; MAN2A2; MRPS18C; HR; BTBD7; USP36; MCM3AP-AS1; APOL5; RBM26; ZNF692; CDADC1; NOD1; DENND2D; NIPSNAP3B; WNT16; PMS2; PMS2CL; BACH2; SGPP1; YIPF5; TBL1XR1; RBBP9; CLEC7A; VPS37B; GNA12; RBM12B; UBE2H; LETM1; AKAP13; C19orf54; EPS15L1; MRM2; DCLRE1C; RING1; STK10; ATN1; TMEM222; SIGIRR; MICALL1"	""	""	"18"	"50"	"years"	""	"B cell"	"CL:0000236"	"PHB; ACTR1A; GNB1; LAMC1; FKBP4; IPO7; USP9X; BHLHE40; SELENOW; WSB1; CACYBP; SOX4; ETF1; TPD52; ACIN1; SAFB; SPEN; LANCL1; SDHD; MTMR3; FBXO28; IKBKAP; BCL7B; APPBP2; GTF2E2; ITM2A; PPP2R1B; DYRK2; MEF2D; TGFB1; TLE1; RBM16; ARHGEF9; SLC35A1; SLC25A12; MTF2; PSD3; HES1; SORL1; LSM1; TFDP2; INPP5F; UTP14C; COBLL1; PCNT; TMOD1; TDG; DMXL1; CD302; WIPI1; SLC31A1; STK19; FOXO3; AMT; NF1; KHSRP; ELMO1; PARM1; PANX1; MGMT; HUS1; PEX11A; IL6; NR3C2; KMO; PDZK1; ZBTB20; SMAD3; DNAJC8; DIAPH2; NCOA2; AFF3; ZNF107; DDX18; TCP11L1; TRPC1; WASL; ZNF264; RNH1; LRRC37A3; ZNF35; CXCR5; TGM4; NDRG2; OAS2; F11; CUBN; FGF18; HGFAC; ASS1; NOX1; SEPT9; SNRK; BTN3A1; RAB28; DGKQ; OGT; ARID1A; PAX3; PSEN1; RBPJ; TNFRSF4; MYO7A; EVI5; RCAN1; TBPL1; PER2; CD164; PTRF; NEU1; FADS1; COPS7A; NHP2; USP10; MPDU1; CDC42EP3; NECAP1; IFI35; RBPMS; PRUNE; SLC1A4; KPNA4; SLC19A2; CORO2B; NPAT; CREM; GPD2; RAPGEF3; MAPK13; LAMA5; PCMT1; MTSS1; ANKMY1; NFATC3; KLHL20; PFKM; CROCCL1; NFYC; CFLAR; FGFR2; SC5DL; NFIB; HOPX; PNN; WIPF2; DHX9; CYFIP1; RNF187; AGRN; FEM1B; RRAS2; WWP1; DHX29; PHLPP1; PAPOLA; ARHGAP19; NFATC2IP; JAM3; DICER1; MAPK8IP1; OLFML2A; TAF6L; DIDO1; RPL28; PPM1B; TUBGCP4; UBE3A; IPW; SNED1; ING2; HIPK2; CLMN; RBFOX2; TTBK2; ID2; ID2B; SPON1; VGLL4; TBC1D1; TMSB15B; SHMT2; YLPM1; N4BP2L2; TRIM33; SFT2D2; KCTD20; SPTBN1; USP34; RXRB; FMO5; KIAA1614; LYST; BTN2A1; GTF2IRD2; GTF2IRD2B; TUBGCP3; NCLN; SKIL; ZNF81; DAAM1; ABCA1; DKC1; SMPD1; NR4A2; DCAF11; KRT3; SCUBE3; EIF4G2; PDAP1; ANGEL2; NAA50; USP39; TNS3; BACE2; SSBP3; MKRN2; TIMM23; TIMM23B; C21orf59; CCDC25; UBE2O; MCTS1; OXR1; FYCO1; EIF2C1; HERC1; GALNT7; PGLS; TOR3A; ANAPC1; SUV39H1; DGCR8; SNX24; CENPM; SLC8B1; SLC35F2; PPP1R13L; PNKP; TIMM16; SLC35E3; C21orf45; NUP43; GALNT11; ZNF576; EIF2C4; FASTKD3; ZDHHC14; MED31; MPP5; CLN8; USE1; ANKRD11; TMEM127; PALB2; DUOX1; ZMAT3; RBM41; MAN2A2; MRPS18C; HR; BTBD7; USP36; MCM3AP-AS1; APOL5; RBM26; ZNF692; CDADC1; NOD1; DENND2D; NIPSNAP3B; WNT16; PMS2; PMS2CL; BACH2; SGPP1; YIPF5; TBL1XR1; RBBP9; CLEC7A; VPS37B; GNA12; RBM12B; UBE2H; LETM1; AKAP13; C19orf54; EPS15L1; MRM2; DCLRE1C; RING1; STK10; ATN1; TMEM222; SIGIRR; MICALL1"	"N"	"gene expression"	"down"	"7d vs 0d"	"time of vaccination"	"7"	"days"	"Fluarix; Fluvirin"	"VO:0000045; VO:0000046"	""	"Influenza A virus (A/Solomon Islands/3/2006(H1N1)); Influenza A virus (A/Wisconsin/67/2005(H3N2)); Influenza B virus (B/Malaysia/2506/2004); Influenza A virus (A/Brisbane/59/2007(H1N1)); Influenza A virus (A/Brisbane/10/2007(H3N2)); Influenza B virus (B/Florida/4/2006); Influenza B virus (B/Brisbane/60/2008)"	"464623; 393902; 464417; 504904; 476294; 461739; 604436"	"2007, 2008, 2009"	""	""	""	"21743478"	"2011"	"https://www.ncbi.nlm.nih.gov/pubmed/?term=21743478"	"Supplementary Table 2a: TIV-Bcells"	"https://www.ncbi.nlm.nih.gov/pmc/articles/PMC3140559/bin/NIHMS301940-supplement-3.xlsx"	""	"307"	"295"	"31"	"308"	"21743478_31_308"
""	"SNRNP200; CALM3; XBP1; SF3B3; YWHAQ; ARF3; GPX1; GNB1; ZNF207; PSMB1; M6PR; KDELR1; COX6A1; DCTN2; SEC31A; ANXA6; PAICS; GOLGB1; TM9SF2; PIP4K2B; ARF4; COPB2; EIF2S1; OTUB1; ANXA4; SNRPC; TPD52L2; COPS6; EIF4E; ATP6AP2; RHEB; TALDO1; SHC1; RCN2; UQCRQ; ANXA2; ICMT; COPS5; CNIH1; RANBP2; CLCN3; WSB2; RELA; NET1; HDAC2; SUPT7L; CYB5R3; RRM2; SLC20A1; DYNLT1; ARFIP2; CPNE3; PLIN3; RIOK3; COPS8; AASDHPPT; BLMH; BLVRB; DCAF8; UBE2B; FABP5; TOR1A; MAML1; DECR1; AIMP1; PRKCD; RANBP9; BLOC1S1; GTF2A2; USP4; PHKB; R3HDM1; CCNG2; AHR; FUCA1; DNAJB12; ATP6V1C1; PBX2; WNK1; PTPN9; MDC1; SMAD2; BAZ2B; DNM1L; GABBR1; IFIT1; PEX5; NPRL2; CDK2AP2; DYNLT3; TERF1; PSEN1; NDUFC1; ARMC8; MED1; PMVK; TERF2; MBNL2; NUCB2; DHX16; ERCC1; RARA; DGUOK; GSTM4; NDC80; CEBPG; APOBEC3G; MT1X; DCAF1; NUP58; SAMHD1; MYO5A; SLC7A7; HHEX; FEN1; TTF1; PLN; ORC5; MNDA; MAP3K8; RBM19; SGCB; CD58; PCMT1; CDC14A; BTN2A2; FTSJ1; PFDN4; AGPS; ISG15; ETFDH; KIN; ITGA4; IL6R; EPHA4; GLRX; BCL2L1; PDE5A; MTHFR; HRK; MED6; LIMS1; GALNT10; GK; ZNF117; AMPD3; RAD50; FGR; BAX; PPP2CA; ST13; RPN2; TMCO1; ATP5MG; FLOT1; CCNG1; PSMA6; POLE3; UBR5; TOP1; C1QBP; NADK; RNF11; PPP4C; BECN1; ERP44; ASPH; GPM6B; KLHDC10; NAB1; TASOR; TBC1D3; TBC1D3C; TBC1D3F; TBC1D3H; PHF20; ZNF32; CD36; RNF113A; RRS1; TOR1B; PAK1; MCCC2; CDC16; SLC35D1; GM2A; TMEM131L; SEC31B; AP5Z1; AIMP2; GART; CD247; CHKB-CPT1B; CPT1B; ME2; NCOA4; TCF3; SIGLEC6; PEX7; PDIA4; PRPF4B; GYG1; ATF6B; TNXB; IGHA1; IGHD; IGHG1; IGHG3; IGHM; IGHV1-69; IGHV3-23; IGHV4-31; IGH; MAK16; IPO5; YARS1; TBC1D9B; CSNK2A1; CBX5; KIDINS220; MT2A; GCOM1; POLR2M; WAPL; SERPINB1; PSMD14; TXLNA; IMP4; SNRNP27; SPTSSA; GPD1L; ZNF451; STK38L; NEMP1; RASA4B; RASA4; MICAL3; YLPM1; FUBP3; SYNJ2; TTI1; SAPCD1; WASHC2A; WASHC2C; UBXN2B; BBX; HEG1; PTPN2; LYRM9; SNAPC5; PLXNC1; GTF2H5; PPP1R7; ITGAL; PCBP2; RNASE6; EIF4E2; NUP50; MED8; PAIP1; PYROXD1; ERAP1; RAP2A; U2AF2; LARP4B; TOP3A; PPFIBP1; CTRL; RAP2B; QKI; MIR22HG; DENND4A; KRT86; CNTNAP2; TIMM17A; ZNF780A; ZNF780B; LTN1; NFYA; CYFIP2; MAST2; SLC39A9; PDIA6; SOD2; IKZF1; PASK; ITCH; IGHA2; IGHG2; LOC100290036; MYO9B; TYMP; CIAO1; MILR1; SPIN1; UBE2J1; SYNCRIP; RAB5IF; IPO9; TM7SF3; BAZ1A; CCNB1IP1; COA3; NFYB; NANS; RPRD1A; WDR74; PLEKHJ1; PRKAG2; SNAP29; THOC7; CRELD2; VPS33B; RPF1; ZCCHC8; GLYR1; TBK1; HECTD3; KCTD9; PAK1IP1; RPS6KC1; DDX60; TIGAR; STN1; PELI2; SLAMF7; ZNF236; C10orf88; THSD1; ZNF226; FBXO38; CHST11; FBXO22; DET1; TMEM260; ANKFY1; ATF7IP2; SLFN12; ANKMY1; SAP30L-AS1; ELMO2; LRRFIP2; OTUD4; IDI2-AS1; TBC1D10B; ATP1A1; GTPBP8; SPATA1; OGFOD1; TMCO6; ITFG1; UTP14A; UTP14C; AAMDC; TAF9B; ZNF83; IL21R; TENT5A; DNAJC10; PGAP3; CYLD; CLTB; FAHD2A; DESI2; RNF19B; PRDX2; CELSR1; DMAC2; RABEP2"	""	""	"18"	"50"	"years"	""	"B cell"	"CL:0000236"	"SNRNP200; CALM3; XBP1; SF3B3; YWHAQ; ARF3; GPX1; GNB1; ZNF207; PSMB1; M6PR; KDELR1; COX6A1; DCTN2; SEC31A; ANXA6; PAICS; GOLGB1; TM9SF2; PIP4K2B; ARF4; COPB2; EIF2S1; OTUB1; ANXA4; SNRPC; TPD52L2; COPS6; EIF4E; ATP6AP2; RHEB; TALDO1; SHC1; RCN2; UQCRQ; ANXA2; ICMT; COPS5; CNIH; RANBP2; CLCN3; WSB2; RELA; NET1; HDAC2; SUPT7L; CYB5R3; RRM2; SLC20A1; DYNLT1; ARFIP2; CPNE3; PLIN3; RIOK3; COPS8; AASDHPPT; BLMH; BLVRB; DCAF8; UBE2B; FABP5; TOR1A; MAML1; DECR1; AIMP1; PRKCD; RANBP9; BLOC1S1; GTF2A2; USP4; PHKB; R3HDM1; CCNG2; AHR; FUCA1; DNAJB12; ATP6V1C1; PBX2; WNK1; PTPN9; MDC1; SMAD2; BAZ2B; DNM1L; GABBR1; IFIT1; PEX5; NPRL2; CDK2AP2; DYNLT3; TERF1; PSEN1; NDUFC1; ARMC8; MED1; PMVK; TERF2; MBNL2; NUCB2; DHX16; ERCC1; RARA; DGUOK; GSTM4; NDC80; CEBPG; APOBEC3G; MT1X; VPRBP; NUPL1; SAMHD1; MYO5A; SLC7A7; HHEX; FEN1; TTF1; PLN; ORC5L; MNDA; MAP3K8; RBM19; SGCB; CD58; PCMT1; CDC14A; BTN2A2; FTSJ1; PFDN4; AGPS; ISG15; ETFDH; KIN; ITGA4; IL6R; EPHA4; GLRX; BCL2L1; PDE5A; MTHFR; HRK; MED6; LIMS1; GALNT10; GK; ZNF117; AMPD3; RAD50; FGR; BAX; PPP2CA; ST13; RPN2; TMCO1; ATP5L; FLOT1; CCNG1; PSMA6; POLE3; UBR5; TOP1; C1QBP; NADK; RNF11; PPP4C; BECN1; ERP44; ASPH; GPM6B; KLHDC10; NAB1; FAM208A; TBC1D3; TBC1D3C; TBC1D3F; TBC1D3H; PHF20; ZNF32; CD36; RNF113A; RRS1; TOR1B; PAK1; MCCC2; CDC16; SLC35D1; GM2A; TMEM131L; SEC31B; AP5Z1; AIMP2; GART; CD247; CHKB-CPT1B; CPT1B; ME2; NCOA4; TCF3; SIGLEC6; PEX7; PDIA4; PRPF4B; GYG1; ATF6B; TNXB; IGHA1; IGHD; IGHG1; IGHG3; IGHM; IGHV1-69; IGHV3-23; IGHV4-31; IGH; MAK16; IPO5; YARS; TBC1D9B; CSNK2A1; CBX5; KIDINS220; MT2A; GCOM1; POLR2M; WAPAL; SERPINB1; PSMD14; TXLNA; IMP4; SNRNP27; C14orf147; GPD1L; ZNF451; STK38L; TMEM194A; RASA4B; RASA4; MICAL3; YLPM1; FUBP3; SYNJ2; KIAA0406; C6orf26; WASHC2A; WASHC2C; UBXN2B; BBX; HEG1; PTPN2; C17orf108; SNAPC5; PLXNC1; GTF2H5; PPP1R7; ITGAL; PCBP2; RNASE6; EIF4E2; NUP50; MED8; PAIP1; PYROXD1; ERAP1; RAP2A; U2AF2; LARP4B; TOP3A; PPFIBP1; CTRL; RAP2B; QKI; MIR22HG; DENND4A; KRT86; CNTNAP2; TIMM17A; ZNF780A; ZNF780B; LTN1; NFYA; CYFIP2; MAST2; SLC39A9; PDIA6; SOD2; IKZF1; PASK; ITCH; IGHA2; IGHG2; LOC100290036; MYO9B; TYMP; CIAO1; C17orf60; SPIN1; UBE2J1; SYNCRIP; C20orf24; IPO9; TM7SF3; BAZ1A; CCNB1IP1; CCDC56; NFYB; NANS; RPRD1A; WDR74; PLEKHJ1; PRKAG2; SNAP29; THOC7; CRELD2; VPS33B; RPF1; ZCCHC8; GLYR1; TBK1; HECTD3; KCTD9; PAK1IP1; RPS6KC1; DDX60; C12orf5; OBFC1; PELI2; SLAMF7; ZNF236; C10orf88; THSD1; ZNF226; FBXO38; CHST11; FBXO22; DET1; C14orf101; ANKFY1; ATF7IP2; SLFN12; ANKMY1; SAP30L-AS1; ELMO2; LRRFIP2; OTUD4; IDI2-AS1; TBC1D10B; ATP1A1; GTPBP8; SPATA1; OGFOD1; TMCO6; ITFG1; UTP14A; UTP14C; C11orf67; TAF9B; ZNF83; IL21R; FAM46A; DNAJC10; PGAP3; CYLD; CLTB; FAHD2A; PPPDE1; RNF19B; PRDX2; CELSR1; ATP5SL; RABEP2"	"N"	"gene expression"	"up"	"7d vs 0d"	"time of vaccination"	"7"	"days"	"Fluarix; Fluvirin"	"VO:0000045; VO:0000046"	""	"Influenza A virus (A/Solomon Islands/3/2006(H1N1)); Influenza A virus (A/Wisconsin/67/2005(H3N2)); Influenza B virus (B/Malaysia/2506/2004); Influenza A virus (A/Brisbane/59/2007(H1N1)); Influenza A virus (A/Brisbane/10/2007(H3N2)); Influenza B virus (B/Florida/4/2006); Influenza B virus (B/Brisbane/60/2008)"	"464623; 393902; 464417; 504904; 476294; 461739; 604436"	"2007, 2008, 2009"	""	""	""	"21743478"	"2011"	"https://www.ncbi.nlm.nih.gov/pubmed/?term=21743478"	"Supplementary Table 2a: TIV-Bcells"	"https://www.ncbi.nlm.nih.gov/pmc/articles/PMC3140559/bin/NIHMS301940-supplement-3.xlsx"	""	"401"	"369"	"32"	"309"	"21743478_32_309"
""	"TRBV5-4; TRBV5-5; TRBV5-8; TRBV6-1; TRBV7-3; TRBV7-4; TRBV12-4"	""	""	"52"	"75"	"years"	""	"naive T cell"	"CL:0000898"	"TRBV5-4; TRBV5-5; TRBV5-8; TRBV6-1; TRBV7-3; TRBV7-4; TRBV12-4"	"N"	"gene expression"	"up"	"CD4-positive T cell vs naive CD4-positive T cell"	"time of vaccination"	"7 to 9"	"days"	"Zostavax"	"VO:0000124"	""	"Human alphaherpesvirus 3"	"10335"	""	""	""	""	"27030598"	"2016"	"https://www.ncbi.nlm.nih.gov/pubmed/?term=27030598"	"Table S3"	"https://www.ncbi.nlm.nih.gov/pmc/articles/PMC4878824/bin/NIHMS784868-supplement-Supplemental_Text_and_Figures.pdf"	"Table S3. BV and BJ gene segment usage in VZV-reactive CD4 T cells compared to naive and memory CD4 T cells (FDR <= 0.1)."	"7"	"7"	"1"	"310"	"27030598_1_310"
""	"TRBV5-8; TRBV7-3; TRBV7-4; TRBV12-4"	""	""	"52"	"75"	"years"	""	"CD4-positive, alpha-beta memory T cell"	"CL:0000897"	"TRBV5-8; TRBV7-3; TRBV7-4; TRBV12-4"	"N"	"gene expression"	"up"	"CD4-positive T cell vs naive CD4-positive T cell"	"time of vaccination"	"7 to 9"	"days"	"Zostavax"	"VO:0000124"	""	"Human alphaherpesvirus 3"	"10335"	""	""	""	""	"27030598"	"2016"	"https://www.ncbi.nlm.nih.gov/pubmed/?term=27030598"	"Table S3"	"https://www.ncbi.nlm.nih.gov/pmc/articles/PMC4878824/bin/NIHMS784868-supplement-Supplemental_Text_and_Figures.pdf"	"Table S3. BV and BJ gene segment usage in VZV-reactive CD4 T cells compared to naive and memory CD4 T cells (FDR <= 0.1)."	"4"	"4"	"2"	"311"	"27030598_2_311"
""	"TRBV10-3; TRBV14; TRBV15; TRBV19; TRBV20-1; TRBV4-3; TRBV5-3; TRBJ2-1"	""	""	"52"	"75"	"years"	""	"naive T cell"	"CL:0000898"	"TRBV10-3; TRBV14; TRBV15; TRBV19; TRBV20-1; TRBV4-3; TRBV5-3; TRBJ2-1"	"N"	"gene expression"	"down"	"CD4-positive T cell vs naive CD4-positive T cell"	"time of vaccination"	"7 to 9"	"days"	"Zostavax"	"VO:0000124"	""	"Human alphaherpesvirus 3"	"10335"	""	""	""	""	"27030598"	"2016"	"https://www.ncbi.nlm.nih.gov/pubmed/?term=27030598"	"Table S3"	"https://www.ncbi.nlm.nih.gov/pmc/articles/PMC4878824/bin/NIHMS784868-supplement-Supplemental_Text_and_Figures.pdf"	"Table S3. BV and BJ gene segment usage in VZV-reactive CD4 T cells compared to naive and memory CD4 T cells (FDR <= 0.1)."	"8"	"8"	"3"	"312"	"27030598_3_312"
""	"TRBV10-3; TRBV14; TRBV15; TRBV19; TRBV20-1; TRBV4-3; TRBV5-3; TRBJ1-4; TRBJ1-5; TRBJ2-1"	""	""	"52"	"75"	"years"	""	"CD4-positive, alpha-beta memory T cell"	"CL:0000897"	"TRBV10-3; TRBV14; TRBV15; TRBV19; TRBV20-1; TRBV4-3; TRBV5-3; TRBJ1-4; TRBJ1-5; TRBJ2-1"	"N"	"gene expression"	"down"	"CD4-positive T cell vs naive CD4-positive T cell"	"time of vaccination"	"7 to 9"	"days"	"Zostavax"	"VO:0000124"	""	"Human alphaherpesvirus 3"	"10335"	""	""	""	""	"27030598"	"2016"	"https://www.ncbi.nlm.nih.gov/pubmed/?term=27030598"	"Table S3"	"https://www.ncbi.nlm.nih.gov/pmc/articles/PMC4878824/bin/NIHMS784868-supplement-Supplemental_Text_and_Figures.pdf"	"Table S3. BV and BJ gene segment usage in VZV-reactive CD4 T cells compared to naive and memory CD4 T cells (FDR <= 0.1)."	"10"	"10"	"4"	"313"	"27030598_4_313"
""	"ZAP70; CD247; CD3G; LCK; CD8A; CD8B; CD3E; CD3D; LAT; RASGRP1; MAP4K1; PRF1; PRKCQ; NFATC3; RASGRP2; NFATC2; FYN; SLA2; PLCG1; PAG1; NFATC1"	""	""	"18"	"64"	"years"	"178"	"T cell"	"CL:0000084"	"ZAP70; CD247; CD3G; LCK; CD8A; CD8B; CD3E; CD3D; LAT; RASGRP1; MAP4K1; PRF1; PRKCQ; NFATC3; RASGRP2; NFATC2; FYN; SLA2; PLCG1; PAG1; NFATC1"	"N"	"gene expression"	"down"	"7d vs 1d"	"time of vaccination"	"7"	"days"	"Pandemrix"	"VO:0000410"	""	"Influenza A virus (A/California/7/2009(H1N1))"	"1316510"	"pan"	"AS03 (GSK)"	""	""	"26726811"	"2016"	"https://www.ncbi.nlm.nih.gov/pubmed/?term=26726811"	"Fig2c"	"https://www.ncbi.nlm.nih.gov/pmc/articles/PMC6485475/figure/F2/"	"- roughly 60/40 female:male ratio, over 70% were Causasian"	"21"	"21"	"8"	"314"	"26726811_8_314"
""	"ZAP70; CD247; CD3G; LCK; CD8A; CD8B; CD3E; CD3D; LAT; RASGRP1; MAP4K1; PRF1; PRKCQ; NFATC3; RASGRP2; NFATC2; FYN; SLA2; PLCG1; PAG1; NFATC1; CXCL9; CXCL10"	""	""	"18"	"64"	"years"	"178"	"T cell"	"CL:0000084"	"ZAP70; CD247; CD3G; LCK; CD8A; CD8B; CD3E; CD3D; LAT; RASGRP1; MAP4K1; PRF1; PRKCQ; NFATC3; RASGRP2; NFATC2; FYN; SLA2; PLCG1; PAG1; NFATC1; CXCL9; CXCL10"	"N"	"gene expression"	"up"	"1d vs 0d"	"time of vaccination"	"1"	"day"	"Pandemrix"	"VO:0000410"	""	"Influenza A virus (A/California/7/2009(H1N1))"	"1316510"	"pan"	"AS03 (GSK)"	""	""	"26726811"	"2016"	"https://www.ncbi.nlm.nih.gov/pubmed/?term=26726811"	"Fig2c"	"https://www.ncbi.nlm.nih.gov/pmc/articles/PMC6485475/figure/F2/"	"- roughly 60/40 female:male ratio, over 70% were Causasian"	"23"	"23"	"9"	"315"	"26726811_9_315"
""	"NBPF15; ANKRD30BL; UBE2E2; RTP4; XRCC4; RPP40; GPLD1; RN7SK; ZC2HC1A; RHEBL1; NPIPB12; GINS3; SIGLEC17P"	""	"healthy volunteers"	""	""	""	""	"T cell"	"CL:0000084"	"NBPF15; ANKRD30BL; UBE2E2; RTP4; XRCC4; RPP40; GPLD1; RN7SK; ZC2HC1A; RHEBL1; NPIPB12; GINS3; SIGLEC17P"	"N"	"gene expression"	"up"	"1d vs 0d"	"time of vaccination"	"1"	"day"	"2011-2012 trivalent inactivated vaccine (A/California/7/09 (H1N1), A/Perth /16/2009 (H3N2), B/Brisbane/60/2008)"	"VO:0004810"	""	"Influenza A virus (A/California/7/2009(H1N1)); Influenza A virus (A/Perth/16/2009(H3N2)); Influenza B virus (B/Brisbane/60/2008)"	"1316510; 654811; 604436"	"2011"	""	""	""	"25706537"	"2015"	"https://www.ncbi.nlm.nih.gov/pubmed/?term=25706537"	"S6 Dataset"	"https://www.ncbi.nlm.nih.gov/pmc/articles/PMC4338067/bin/pone.0118528.s006.xlsx"	"Up-regulated DE RNA transcripts (up >= 1.5x) shared between both TIV-vaccinated donors"	"15"	"13"	"7"	"316"	"25706537_7_316"
