""	"response_component"	"curation_date"	"cohort"	"age_min"	"age_max"	"age_units"	"number_subjects"	"tissue_type"	"tissue_type_term_id"	"response_component_original"	"is_model"	"response_behavior_type"	"response_behavior"	"comparison"	"baseline_time_event"	"time_point"	"time_point_units"	"exposure_material"	"exposure_material_id"	"additional_exposure_material"	"target_pathogen"	"target_pathogen_taxonid"	"vaccine_year"	"adjuvant"	"route"	"scheduling"	"publication_reference_id"	"publication_date"	"publication_reference_url"	"signature_source"	"signature_source_url"	"comments"	"response_comp_orig_cnt"	"response_comp_cnt"	"sig_subm_id"	"sig_row_id"	"row_key"
"subject"	"gene"	""	""	""	""	""	""	""	"cell_subset"	""	""	""	""	""	""	""	""	""	"vaccine"	""	""	"pathogen"	""	""	""	""	""	""	""	""	""	""	""	""	""	""	""
"evidence"	""	"label"	"label"	"label"	"label"	"label"	"label"	"label"	""	"label"	"label"	"label"	"label"	"label"	"label"	"label"	"label"	"label"	""	"label"	"label"	""	"label"	"label"	"label"	"label"	"label"	"label"	"url"	"label"	"label"	"label"	"label"	"label"	"label"	"label"	"label"
"role"	"gene_biomarker"	"background"	"observed"	"observed"	"observed"	"observed"	"observed"	"background"	"tissue"	"observed"	"background"	"background"	"measured"	"background"	"background"	"observed"	"observed"	"background"	"vaccine"	"background"	"background"	"pathogen"	"background"	"background"	"background"	"background"	"background"	"background"	"reference"	"background"	"background"	"background"	"observed"	"observed"	"background"	"background"	"background"
"mime_type"	""	""	""	""	""	""	""	""	""	""	""	""	""	""	""	""	""	""	""	""	""	""	""	""	""	""	""	""	""	""	""	""	""	""	""	""	""
"numeric_units"	""	""	""	""	""	""	""	""	""	""	""	""	""	""	""	""	""	""	""	""	""	""	""	""	""	""	""	""	""	""	""	""	""	""	""	""	""
"display_text"	"response component"	"curation date YYYY-MM-DD "	"Cohort - any characteristics of the population(s) studied, plus whether the result was taken from a subgroup of the broader cohort tested."	"age_min - age of youngest subject including both cases and controls"	"age_max - age of oldest subject including both case and controls"	"age units"	"number of subjects - count of case plus control subjects used in the measurement."	"tissue type"	"tissue (Cell Ontology)"	"response component (original gene symbol)"	"signature was derived from a computational model"	"response behavior type"	"response behavior (direction, correlation type etc.)"	"comparison (affected vs control, correlated variable, time vs baseline event etc.)"	"baseline time event"	"time point relative to baseline event at which response was measured"	"time point units"	"exposure material (vaccine name)"	"exposure material (vaccine ontology)"	"exposure material - additional"	"target pathogen"	"target pathogen (NCBI TaxID)"	"vaccine year (influenza only)"	"adjuvant"	"route"	"scheduling"	"publication reference (PMID)"	"print publication date or posted date (YYYY-MM-DD or YYYY)"	"publication url"	"signature source figure, table or text section"	"signature source url"	"comments and additional details"	"response component (original) count"	"response component count"	"sequential ID of signature within a publication (PMID) and for its response_type "	"row ID of signature within its submission data file(s)"	"row key"
""	"STAT1"	""	"Caucasian males, subgroup high responders"	"18"	"40"	"years"	"119"	"peripheral blood mononuclear cell"	"CL:2000001"	"STAT1"	"N"	"gene expression"	"up"	"1d vs 0d"	"time of vaccination"	"1"	"day"	"Fluarix; Fluvirin"	"VO:0000045; VO:0000046"	""	"Influenza A virus (A/Brisbane/59/2007(H1N1)); Influenza A virus (A/Brisbane/10/2007(H3N2)); Influenza B virus (B/Florida/4/2006)"	"504904; 476294; 461739"	"2008"	""	""	""	"21357945"	"2011"	"https://www.ncbi.nlm.nih.gov/pubmed/21357945"	"Fig 2B, 2C"	"https://www.ncbi.nlm.nih.gov/pmc/articles/PMC3068032/figure/fig2/"	"STAT1-E2F2 expression differentiates individuals with respect to extremes of titer response index (TRI)"	"1"	"1"	"1"	"8"	"21357945_1_8"
""	"E2F2"	""	"Caucasian males, subgroup high responders"	"18"	"40"	"years"	"119"	"peripheral blood mononuclear cell"	"CL:2000001"	"E2F2"	"N"	"gene expression"	"down"	"3d vs 0d"	"time of vaccination"	"3"	"days"	"Fluarix; Fluvirin"	"VO:0000045; VO:0000046"	""	"Influenza A virus (A/Brisbane/59/2007(H1N1)); Influenza A virus (A/Brisbane/10/2007(H3N2)); Influenza B virus (B/Florida/4/2006)"	"504904; 476294; 461739"	"2008"	""	""	""	"21357945"	"2011"	"https://www.ncbi.nlm.nih.gov/pubmed/21357945"	"Fig 2B, 2C"	"https://www.ncbi.nlm.nih.gov/pmc/articles/PMC3068032/figure/fig2/"	"STAT1-E2F2 expression differentiates individuals with respect to extremes of titer response index (TRI)"	"1"	"1"	"2"	"9"	"21357945_2_9"
""	"STAT1; IRF9; SPI1; CD74; HLA-E; TNFSF13B"	""	"Caucasian males, subgroup high responders"	"18"	"40"	"years"	"119"	"peripheral blood mononuclear cell"	"CL:2000001"	"STAT1; IRF9; SPI1; CD74; HLA-E; TNFSF13B"	"N"	"gene expression"	"positively correlated"	"titer response index"	"time of vaccination"	"1"	"day"	"Fluarix; Fluvirin"	"VO:0000045; VO:0000046"	""	"Influenza A virus (A/Brisbane/59/2007(H1N1)); Influenza A virus (A/Brisbane/10/2007(H3N2)); Influenza B virus (B/Florida/4/2006)"	"504904; 476294; 461739"	"2008"	""	""	""	"21357945"	"2011"	"https://www.ncbi.nlm.nih.gov/pubmed/21357945"	"Table 1"	"https://www.ncbi.nlm.nih.gov/pmc/articles/PMC3068032/table/tbl1/"	"Signature predictive of titer response index (TRI). Day 1 and day 3 values averaged."	"6"	"6"	"3"	"10"	"21357945_3_10"
""	"STAT1; IRF9; SPI1; CD74; HLA-E; TNFSF13B"	""	"Caucasian males, subgroup high responders"	"18"	"40"	"years"	"119"	"peripheral blood mononuclear cell"	"CL:2000001"	"STAT1; IRF9; SPI1; CD74; HLA-E; TNFSF13B"	"N"	"gene expression"	"positively correlated"	"titer response index"	"time of vaccination"	"3"	"days"	"Fluarix; Fluvirin"	"VO:0000045; VO:0000046"	""	"Influenza A virus (A/Brisbane/59/2007(H1N1)); Influenza A virus (A/Brisbane/10/2007(H3N2)); Influenza B virus (B/Florida/4/2006)"	"504904; 476294; 461739"	"2008"	""	""	""	"21357945"	"2011"	"https://www.ncbi.nlm.nih.gov/pubmed/21357945"	"Table 1"	"https://www.ncbi.nlm.nih.gov/pmc/articles/PMC3068032/table/tbl1/"	"Signature predictive of titer response index (TRI). Day 1 and day 3 values averaged."	"6"	"6"	"4"	"11"	"21357945_4_11"
""	"E2F2; PRDX2; PRDX3; PTEN; ITGB1"	""	"Caucasian males, subgroup low responders"	"18"	"40"	"years"	"119"	"peripheral blood mononuclear cell"	"CL:2000001"	"E2F2; PRDX2; PRDX3; PTEN; ITGB1"	"N"	"gene expression"	"positively correlated"	"titer response index"	"time of vaccination"	"1"	"day"	"Fluarix; Fluvirin"	"VO:0000045; VO:0000046"	""	"Influenza A virus (A/Brisbane/59/2007(H1N1)); Influenza A virus (A/Brisbane/10/2007(H3N2)); Influenza B virus (B/Florida/4/2006)"	"504904; 476294; 461739"	"2008"	""	""	""	"21357945"	"2011"	"https://www.ncbi.nlm.nih.gov/pubmed/21357945"	"Table 1"	"https://www.ncbi.nlm.nih.gov/pmc/articles/PMC3068032/table/tbl1/"	"Signature predictive of titer response index (TRI). Day 1 and day 3 values averaged."	"5"	"5"	"5"	"12"	"21357945_5_12"
""	"E2F2; PRDX2; PRDX3; PTEN; ITGB1"	""	"Caucasian males, subgroup low responders"	"18"	"40"	"years"	"119"	"peripheral blood mononuclear cell"	"CL:2000001"	"E2F2; PRDX2; PRDX3; PTEN; ITGB1"	"N"	"gene expression"	"positively correlated"	"titer response index"	"time of vaccination"	"3"	"days"	"Fluarix; Fluvirin"	"VO:0000045; VO:0000046"	""	"Influenza A virus (A/Brisbane/59/2007(H1N1)); Influenza A virus (A/Brisbane/10/2007(H3N2)); Influenza B virus (B/Florida/4/2006)"	"504904; 476294; 461739"	"2008"	""	""	""	"21357945"	"2011"	"https://www.ncbi.nlm.nih.gov/pubmed/21357945"	"Table 1"	"https://www.ncbi.nlm.nih.gov/pmc/articles/PMC3068032/table/tbl1/"	"Signature predictive of titer response index (TRI). Day 1 and day 3 values averaged."	"5"	"5"	"6"	"13"	"21357945_6_13"
""	"LILRB3; DAPP1; HLA-G; LILRB1; PIGR; TAPBP; CSF2RA; CD27; FCGR1A; ISG15; IRF9; STAT1; STAT2; TNFSF14; RBCK1; PNPT1; CORO1A; PRKD2; SNRNP70"	""	"Caucasian males, subgroup high responders"	"18"	"40"	"years"	"119"	"peripheral blood mononuclear cell"	"CL:2000001"	"LILRB3; DAPP1; HLA-G; LILRB1; PIGR; TAPBP; CSF2RA; CD27; FCGR1A; ISG15; IRF9; STAT1; STAT2; TNFSF14; RBCK1; PNPT1; CORO1A; PRKD2; SNRNP70"	"N"	"gene expression"	"positively correlated"	"a functional network"	"time of vaccination"	"1"	"day"	"Fluarix; Fluvirin"	"VO:0000045; VO:0000046"	""	"Influenza A virus (A/Brisbane/59/2007(H1N1)); Influenza A virus (A/Brisbane/10/2007(H3N2)); Influenza B virus (B/Florida/4/2006)"	"504904; 476294; 461739"	"2008"	""	""	""	"21357945"	"2011"	"https://www.ncbi.nlm.nih.gov/pubmed/21357945"	"Fig 3C"	"https://www.ncbi.nlm.nih.gov/pmc/articles/PMC3068032/figure/fig3/"	"Top functional network for genes preferentially upregulated in the high responder group"	"19"	"19"	"7"	"14"	"21357945_7_14"
""	"FCRL5"	""	""	"18"	"45"	"years"	""	"peripheral blood mononuclear cell"	"CL:2000001"	"FCRL5"	"N"	"gene expression"	"up"	"7d vs 0d"	"time of vaccination"	"7"	"days"	"Menomune A/C/Y/W-135"	"VO:0010727"	""	"Neisseria meningitidis"	"487"	""	""	""	""	"24336226"	"2014"	"https://www.ncbi.nlm.nih.gov/pubmed/24336226"	"Fig 3"	"https://www.ncbi.nlm.nih.gov/pmc/articles/PMC3946932/figure/F3/"	""	"1"	"1"	"1"	"15"	"24336226_1_15"
""	"FCRL5; IGH; IGHD; IGHE; IGHG1; IGHG3; JCHAIN; IGLL1; IGLV2-14; TNFRSF13B; TNFRSF17; HSP90B1; PDIA6; TXNDC5"	""	""	"18"	"45"	"years"	""	"peripheral blood mononuclear cell"	"CL:2000001"	"FCRL5; IGH; IGHD; IGHE; IGHG1; IGHG3; JCHAIN; IGLL1; IGLV2-14; TNFRSF13B; TNFRSF17; HSP90B1; PDIA6; TXNDC5"	"N"	"gene expression"	"up"	"3d vs 0d"	"time of vaccination"	"7"	"days"	"Menactra"	"VO:0000071"	""	"Neisseria meningitidis"	"487"	""	""	""	""	"24336226"	"2014"	"https://www.ncbi.nlm.nih.gov/pubmed/24336226"	"Fig 4"	"https://www.ncbi.nlm.nih.gov/pmc/articles/PMC3946932/figure/F4/"	""	"14"	"14"	"2"	"16"	"24336226_2_16"
""	"OAS2"	""	""	"18"	"45"	"years"	""	"peripheral blood mononuclear cell"	"CL:2000001"	"OAS2"	"N"	"gene expression"	"up"	"3d vs 0d"	"time of vaccination"	"3"	"days"	"Menactra"	"VO:0000071"	""	"Neisseria meningitidis"	"487"	""	""	""	""	"24336226"	"2014"	"https://www.ncbi.nlm.nih.gov/pubmed/24336226"	"Fig 5"	"https://www.ncbi.nlm.nih.gov/pmc/articles/PMC3946932/figure/F5/"	""	"1"	"1"	"3"	"17"	"24336226_3_17"
""	"C3; C3AR1; C1S; CFD; A2M; CR1; TBC1D8; AIF1; TLR4; IL6; ADAMTS20; IFNA16; FGF5; TNR; ITGB4; COL8A1; IFNA5; IFNA21; PRL"	""	""	"18"	"45"	"years"	""	"peripheral blood mononuclear cell"	"CL:2000001"	"C3; C3AR1; C1S; CFD; A2M; CR1; TBC1D8; AIF1; TLR4; IL6; ADAMTS20; IFNA16; FGF5; TNR; ITGB4; COL8A1; IFNA5; IFNA21; PRL"	"N"	"gene expression"	"down"	"3d vs 0d"	"time of vaccination"	"3"	"days"	"Menomune A/C/Y/W-135"	"VO:0010727"	""	"Neisseria meningitidis"	"487"	""	""	""	""	"24336226"	"2014"	"https://www.ncbi.nlm.nih.gov/pubmed/24336226"	"Fig 5b"	"https://www.ncbi.nlm.nih.gov/pmc/articles/PMC3946932/figure/F5/"	""	"19"	"19"	"4"	"18"	"24336226_4_18"
""	"CFB; CFH; C7; A2M; STAB1; IL1A; IFNA7; IFNA10; MMP12; TNR; ITGB4; IMPG2; IFNA21; PRL; IFNA8; AMER2"	""	"subgroup anti-polysaccharide antibody-correlation profile"	"18"	"45"	"years"	""	"peripheral blood mononuclear cell"	"CL:2000001"	"CFB; CFH; C7; A2M; STAB1; IL1A; IFNA7; IFNA10; MMP12; TNR; ITGB4; IMPG2; IFNA21; PRL; IFNA8; AMER2"	"N"	"gene expression"	"down"	"3d vs 0d"	"time of vaccination"	"3"	"days"	"Menactra"	"VO:0000071"	""	"Neisseria meningitidis"	"487"	""	""	""	""	"24336226"	"2014"	"https://www.ncbi.nlm.nih.gov/pubmed/24336226"	"Fig 5b"	"https://www.ncbi.nlm.nih.gov/pmc/articles/PMC3946932/figure/F5/"	""	"16"	"16"	"5"	"19"	"24336226_5_19"
""	"C3; C2; C1S; C1R; CFH; C7; A2M; C1QC; GPX1; CCL20; PTX3; IL6; IL1B; CXCL8; IFNA14; TNR; LAMC2; IMPG2; PRL"	""	"subgroup anti-DT antibody-correlation profile"	"18"	"45"	"years"	""	"peripheral blood mononuclear cell"	"CL:2000001"	"C3; C2; C1S; C1R; CFH; C7; A2M; C1QC; GPX1; CCL20; PTX3; IL6; IL1B; IL8; IFNA14; TNR; LAMC2; IMPG2; PRL"	"N"	"gene expression"	"down"	"3d vs 0d"	"time of vaccination"	"3"	"days"	"Menactra"	"VO:0000071"	""	"Neisseria meningitidis"	"487"	""	""	""	""	"24336226"	"2014"	"https://www.ncbi.nlm.nih.gov/pubmed/24336226"	"Fig 5b"	"https://www.ncbi.nlm.nih.gov/pmc/articles/PMC3946932/figure/F5/"	""	"19"	"19"	"6"	"20"	"24336226_6_20"
""	"SERPING1; CFB; C2; C1QB; C5AR1; C1QA; CFH; A2M; C1QC; GPX1; CARD9; ARRB2; APOBR; CCL20; PTX3; IL1A; IL1B; CXCL8; TNF; LHCGR; IFNA7; IFNA16; MMP12; LAMC2; ST14; IMPG2; SFN; IFNA2; AMER2"	""	""	"18"	"45"	"years"	""	"peripheral blood mononuclear cell"	"CL:2000001"	"SERPING1; CFB; C2; C1QB; C5AR1; C1QA; CFH; A2M; C1QC; GPX1; CARD9; ARRB2; APOBR; CCL20; PTX3; IL1A; IL1B; IL8; TNF; LHCGR; IFNA7; IFNA16; MMP12; LAMC2; ST14; IMPG2; SFN; IFNA2; AMER2"	"N"	"gene expression"	"up"	"3d vs 0d"	"time of vaccination"	"3"	"days"	"Menomune A/C/Y/W-135"	"VO:0010727"	""	"Neisseria meningitidis"	"487"	""	""	""	""	"24336226"	"2014"	"https://www.ncbi.nlm.nih.gov/pubmed/24336226"	"Fig 5b"	"https://www.ncbi.nlm.nih.gov/pmc/articles/PMC3946932/figure/F5/"	""	"29"	"29"	"7"	"21"	"24336226_7_21"
""	"C3; SERPING1; C3AR1; C2; C1QB; C1R; C5AR1; CFD; C1QA; CFI; TYROBP; TBC1D8; GPX1; AIF1; TLR4; FCER1G; CARD9; APOBR; CCL20; PTX3; CCRL2; IL6; IL1B; CXCL8; TNF; LHCGR; IFNA4; IFNA16; ST14; IFNA2; IFNA21; FGF5"	""	"subgroup anti-polysaccharide antibody-correlation profile"	"18"	"45"	"years"	""	"peripheral blood mononuclear cell"	"CL:2000001"	"C3; SERPING1; C3AR1; C2; C1QB; C1R; C5AR1; CFD; C1QA; CFI; TYROBP; TBC1D8; GPX1; AIF1; TLR4; FCER1G; CARD9; APOBR; CCL20; PTX3; CCRL2; IL6; IL1B; IL8; TNF; LHCGR; IFNA4; IFNA16; ST14; IFNA2; IFNA21; FGF5"	"N"	"gene expression"	"up"	"3d vs 0d"	"time of vaccination"	"3"	"days"	"Menactra"	"VO:0000071"	""	"Neisseria meningitidis"	"487"	""	""	""	""	"24336226"	"2014"	"https://www.ncbi.nlm.nih.gov/pubmed/24336226"	"Fig 5b"	"https://www.ncbi.nlm.nih.gov/pmc/articles/PMC3946932/figure/F5/"	""	"33"	"32"	"8"	"22"	"24336226_8_22"
""	"IL1R2; CD9; CD1B; CD1C; PCTP; HLA-DPB1; HLA-DPA1; HLA-DQB1; HLA-DRA; HLA-DRB1; CD74; HLA-A; HLA-C; HLA-E; CD4; HLA-G; CD83; SLAMF8; CXCL2; PLXDC2; ATP1B1; HLA-DMA; WDFY4; FAR2; ASPH; HMOX1; SLC27A2; PTGS2; PLAUR; TNF; NFKBID; NFKB2; MAP3K8; IL23A; CCL5; EBI3; BCL3; ICAM1; CCL20; PDE4B; CD80; IFNG; IL1B"	""	""	"18"	"45"	"years"	""	"peripheral blood mononuclear cell"	"CL:2000001"	"IL1R2; CD9; CD1B; CD1C; PCTP; HLA-DPB1; HLA-DPA1; HLA-DQB1; HLA-DRA1; HLA-DRB1; CD74; HLA-A; HLA-C; HLA-E; CD4; HLA-G; CD83; SLAMF8; CXCL2; PLXDC2; ATP1B1; HLA-DMA; WDFY4; FAR2; ASPH; HMOX1; SLC27A2; PTGS2; PLAUR; TNF; NFKBID; NFKB2; MAP3K8; IL23A; CCL5; EBI3; BCL3; ICAM1; CCL20; PDE4B; CD80; IFNG; IL1B"	"N"	"gene expression"	"positively correlated"	"antibody response"	"time of vaccination"	"3"	"days"	"Menomune A/C/Y/W-135"	"VO:0010727"	""	"Neisseria meningitidis"	"487"	""	""	""	""	"24336226"	"2014"	"https://www.ncbi.nlm.nih.gov/pubmed/24336226"	"Supplementary Fig 13"	"https://www.ncbi.nlm.nih.gov/pmc/articles/PMC3946932/bin/NIHMS540680-supplement-13.jpg"	""	"43"	"43"	"9"	"23"	"24336226_9_23"
""	"CSF1R; ANPEP; TLR8; ASGR1; BCL6; AP1S2; HLA-DQA1; HLA-F; TLR7; RIN2; IL4I1; PRKCD; CD86; RGL1; CD1D; METTL7A; CYP1B1; GPAT3; FUT7; SAMSN1; CCN2; STAT4; HS3ST3B1; TNFAIP6; CCL4"	""	""	"18"	"45"	"years"	""	"peripheral blood mononuclear cell"	"CL:2000001"	"CSF1R; ANPEP; TLR8; ASGR1; BCL6; AP1S2; HLA-DQA1; HLA-F; TLR7; RIN2; IL4I1; PRKCD; CD86; RGL1; CD1D; METTL7A; CYP1B1; GPAT3; FUT7; SAMSN1; CTGF; STAT4; HS3ST3B1; TNFAIP6; CCL4"	"N"	"gene expression"	"negatively correlated"	"antibody response"	"time of vaccination"	"3"	"days"	"Menomune A/C/Y/W-135"	"VO:0010727"	""	"Neisseria meningitidis"	"487"	""	""	""	""	"24336226"	"2014"	"https://www.ncbi.nlm.nih.gov/pubmed/24336226"	"Supplementary Fig 13"	"https://www.ncbi.nlm.nih.gov/pmc/articles/PMC3946932/bin/NIHMS540680-supplement-13.jpg"	""	"25"	"25"	"10"	"24"	"24336226_10_24"
""	"CSF1R; CD9; CD1B; CD1C; CSF2RA; CD1A; TLR8; TBXAS1; ASGR2; TNFSF13B; ASGR1; BCL6; PCTP; HLA-DPB1; HLA-DPA1; HLA-DRA; HLA-DQA1; HLA-DRB1; HLA-DRB4; HLA-F; TLR7; HLA-A; HLA-B; HLA-E; HLA-G; CD83; SLAMF8; RIN2; IL4I1; PRKCD; IL1RN; CXCL2; CD86; RGL1; PLXDC2; CD1D; HLA-DMA; METTL7A; FAR2; CYP1B1; HMOX1; RTN1; PTGS2; PLAUR; TNF; NFKBID; FUT7; MAP3K8; SAMSN1; RELB; EBI3; ICAM1; CCL20; PDE4B; GCH1; IFNG; CCL4; TNFAIP6; SERPINB9; IL1B"	""	"subgroup anti-polysaccharide antibody-correlation profile"	"18"	"45"	"years"	""	"peripheral blood mononuclear cell"	"CL:2000001"	"CSF1R; CD9; CD1B; CD1C; CSF2RA; CD1A; TLR8; TBXAS1; ASGR2; TNFSF13B; ASGR1; BCL6; PCTP; HLA-DPB1; HLA-DPA1; HLA-DRA; HLA-DQA1; HLA-DRB1; HLA-DRB4; HLA-F; TLR7; HLA-A; HLA-B; HLA-E; HLA-G; CD83; SLAMF8; RIN2; IL4I1; PRKCD; IL1RN; CXCL2; CD86; RGL1; PLXDC2; CD1D; HLA-DMA; METTL7A; FAR2; CYP1B1; HMOX1; RTN1; PTGS2; PLAUR; TNF; NFKBID; FUT7; MAP3K8; SAMSN1; RELB; EBI3; ICAM1; CCL20; PDE4B; GCH1; IFNG; CCL4; TNFAIP6; SERPINB9; IL1B"	"N"	"gene expression"	"positively correlated"	"antibody response"	"time of vaccination"	"3"	"days"	"Menactra"	"VO:0000071"	""	"Neisseria meningitidis"	"487"	""	""	""	""	"24336226"	"2014"	"https://www.ncbi.nlm.nih.gov/pubmed/24336226"	"Supplementary Fig 13"	"https://www.ncbi.nlm.nih.gov/pmc/articles/PMC3946932/bin/NIHMS540680-supplement-13.jpg"	""	"60"	"60"	"11"	"25"	"24336226_11_25"
""	"IL1R2; IL1R1; SLC40A1; AP1S2; HLA-DQB1; HLA-C; CD4; WDFY4; ASPH; ITPR3; SLC27A2; LPCAT1; VCAM1; IL23A; BCL3; CCN2; STAT4; CD80; HS3ST3B1"	""	"subgroup anti-polysaccharide antibody-correlation profile"	"18"	"45"	"years"	""	"peripheral blood mononuclear cell"	"CL:2000001"	"IL1R2; IL1R1; SLC40A1; AP1S2; HLA-DQB1; HLA-C; CD4; WDFY4; ASPH; ITPR3; SLC27A2; AGPAT9; VCAM1; IL23A; BCL3; CTGF; STAT4; CD80; HS3ST3B1"	"N"	"gene expression"	"negatively correlated"	"antibody response"	"time of vaccination"	"3"	"days"	"Menactra"	"VO:0000071"	""	"Neisseria meningitidis"	"487"	""	""	""	""	"24336226"	"2014"	"https://www.ncbi.nlm.nih.gov/pubmed/24336226"	"Supplementary Fig 13"	"https://www.ncbi.nlm.nih.gov/pmc/articles/PMC3946932/bin/NIHMS540680-supplement-13.jpg"	""	"19"	"19"	"12"	"26"	"24336226_12_26"
""	"IL1R2; CSF1R; CD1B; CD1C; CSF2RA; CD1A; TLR8; TBXAS1; TNFSF13B; ASGR1; HLA-DPB1; HLA-DPA1; HLA-DQB1; HLA-DRA; HLA-DRB1; HLA-DRB4; CD74; TLR7; HLA-A; HLA-C; HLA-G; SLAMF8; RIN2; PRKCD; CD86; PLXDC2; CD1D; METTL7A; HLA-DMB; FAR2; ASPH; HMOX1; AGPAT1; RTN1; NFKBID; FUT7; SAMSN1; HS3ST3B1; GCH1; IFNG"	""	"subgroup anti-DT antibody-correlation profile"	"18"	"45"	"years"	""	"peripheral blood mononuclear cell"	"CL:2000001"	"IL1R2; CSF1R; CD1B; CD1C; CSF2RA; CD1A; TLR8; TBXAS1; TNFSF13B; ASGR1; HLA-DPB1; HLA-DPA1; HLA-DQB1; HLA-DRA; HLA-DRB1; HLA-DRB4; CD74; TLR7; HLA-A; HLA-C; HLA-G; SLAMF8; RIN2; PRKCD; CD86; PLXDC2; CD1D; METTL7A; HLA-DMB; FAR2; ASPH; HMOX1; AGPAT1; RTN1; NFKBID; FUT7; SAMSN1; HS3ST3B1; GCH1; IFNG"	"N"	"gene expression"	"positively correlated"	"antibody response"	"time of vaccination"	"3"	"days"	"Menactra"	"VO:0000071"	""	"Neisseria meningitidis"	"487"	""	""	""	""	"24336226"	"2014"	"https://www.ncbi.nlm.nih.gov/pubmed/24336226"	"Supplementary Fig 13"	"https://www.ncbi.nlm.nih.gov/pmc/articles/PMC3946932/bin/NIHMS540680-supplement-13.jpg"	""	"40"	"40"	"13"	"27"	"24336226_13_27"
""	"CD9; PCTP; HLA-DQA1; HLA-B; CD4; CD83; IL4I1; IL1RN; CXCL2; HLA-DMA; CYP1B1; PLAUR; NFKB2; MAP3K8; IL23A; CCL5; RELB; BCL3; ICAM1; CCL20; PDE4B; STAT4; CD80; CCL4; TNFAIP6; SERPINB9; IL1B"	""	"subgroup anti-DT antibody-correlation profile"	"18"	"45"	"years"	""	"peripheral blood mononuclear cell"	"CL:2000001"	"CD9; PCTP; HLA-DQA1; HLA-B; CD4; CD83; IL4I1; IL1RN; CXCL2; HLA-DMA; CYP1B1; PLAUR; NFKB2; MAP3K8; IL23A; CCL5; RELB; BCL3; ICAM1; CCL20; PDE4B; STAT4; CD80; CCL4; TNFAIP6; SERPINB9; IL1B"	"N"	"gene expression"	"negatively correlated"	"antibody response"	"time of vaccination"	"3"	"days"	"Menactra"	"VO:0000071"	""	"Neisseria meningitidis"	"487"	""	""	""	""	"24336226"	"2014"	"https://www.ncbi.nlm.nih.gov/pubmed/24336226"	"Supplementary Fig 13"	"https://www.ncbi.nlm.nih.gov/pmc/articles/PMC3946932/bin/NIHMS540680-supplement-13.jpg"	""	"27"	"27"	"14"	"28"	"24336226_14_28"
""	"C3AR1; CFB; C5AR1; CFD; CFI; CR1; TYROBP; STAB1; TBC1D8; TLR4; FCER1G; CARD9; ARRB2; CCRL2; IL1A; IFNA7; ADAMTS20; IFNA16; IFNA10; ITGB4; ST14; COL8A1; SFN; IFNA2; IFNA5; IFNA21; IFNA8"	""	"subgroup anti-DT antibody-correlation profile"	"18"	"45"	"years"	""	"peripheral blood mononuclear cell"	"CL:2000001"	"C3AR1; CFB; C5AR1; CFD; CFI; CR1; TYROBP; STAB1; TBC1D8; TLR4; FCER1G; CARD9; ARRB2; CCRL2; IL1A; IFNA7; ADAMTS20; IFNA16; IFNA10; ITGB4; ST14; COL8A1; SFN; IFNA2; IFNA5; IFNA21; IFNA8"	"N"	"gene expression"	"up"	"3d vs 0d"	"time of vaccination"	"3"	"days"	"Menactra"	"VO:0000071"	""	"Neisseria meningitidis"	"487"	""	""	""	""	"24336226"	"2014"	"https://www.ncbi.nlm.nih.gov/pubmed/24336226"	"Supplementary Fig 13"	"https://www.ncbi.nlm.nih.gov/pmc/articles/PMC3946932/bin/NIHMS540680-supplement-13.jpg"	""	"27"	"27"	"15"	"29"	"24336226_15_29"
""	"RSAD2; IFI44L; ISG15; IFI44; IFIT1; OAS3; HERC5; IFIT3; LY6E; EPSTI1; IFITM3; IFI27; OAS1; OASL; MX1; HES4; OTOF; XAF1; SERPING1; SPATS2L; MT2A; HERC6; IFIT2; IRF7; EIF2AK2; SAMD9L; OAS2; IFI35; PLSCR1; ZBP1; DHX58; IFI6; MT1A; LAP3; PARP12; IFIH1; HELZ2; DDX60; TRIM22; GBP1; RTP4; PARP14; PARP9; TIMM10; STAT2; DDX58; CTSL; JUP; SCO2; IL1RN; MAFB; LGALS3BP; BST2; FBXO6; NTNG2; CDKN1C; STAT1; UBE2L6; CCR1; TRIM5; IFIT5; PARP10; IFITM1; MOV10; CEACAM1; BLVRA; TNFSF10; TOR1B; GPBAR1; IFI16; EPB41L3; WARS1; TNFSF13B; SAMD4A; TDRD7; TYMP; DHRS9; ZC3HAV1; SHFL; TENT5A; CSRNP1; MYOF; TAP1; DRAP1; C1QA; TMEM140; MX2; SP110; SCARB2; TMEM123; IFI30; ABCA1; TRAFD1; RIN2; CDKN1A; TLR7; CD300C; ABI3; APOBEC3A; PHF11; C1QB; SLC27A3; SEPTIN4; GALM; LGALS9; RGL1; CX3CR1; ADAP2; PTGDS; AIM2; SP140; DUSP5; ADA2; NUB1; RRAS; TAP2; HAVCR2; MICB; TRIM21; IRF9; ADAR; TCN2; ZNFX1; TMEM268; ATF5; NAGK; TTYH3; OSBPL5; GRN; SIDT2; PSME2; SRC; ANKFY1; CYBB; C3AR1; LMO2; SMCO4; LILRB1; CSF1R; TAGLN; REC8; CYSLTR1; FFAR2; ASCL2; CST3; MARCO; SCIMP; RHBDF2; HMOX1; FRMPD1; SHISA5; PLAC8; RBCK1; RNF31; RGS12; KIAA0319L; LHFPL2; TMEM62; TRIM26; IDH2; CD68; TRIM38; GLMP; MAD2L1BP; CNDP2; APOBEC3F; MYD88; GIMAP8; CAMK1; CD86; BTN3A1; PLAGL2; SLC3A2; SNTB1; ASPRV1; AP5B1; SRBD1; UBA7; CASP1; HK3; GADD45B; RNH1; NAGA; FLVCR2; FCN1; FCER1G; PCK2; ZFYVE26; SLC37A2; ACOT9; TICAM1; SUSD1; ADA; SERTAD1; SIL1; TNS3; SORT1; MT1F; DPYSL2; NRROS; RNF135; HLA-A; GORASP1; ALDH3B1; GNGT2; RAB8A; TTC38; RIPK3; PSME1; SIGLEC5; GNA15; NPC2; MS4A7; NAPA; OGFR; KCNMB1; SLC2A6; PRAM1; LYPD2"	""	"Montreal"	""	""	""	""	"peripheral blood mononuclear cell"	"CL:2000001"	"RSAD2; IFI44L; ISG15; IFI44; IFIT1; OAS3; HERC5; IFIT3; LY6E; EPSTI1; IFITM3; IFI27; OAS1; OASL; MX1; HES4; OTOF; XAF1; SERPING1; SPATS2L; MT2A; HERC6; IFIT2; IRF7; EIF2AK2; SAMD9L; OAS2; IFI35; PLSCR1; ZBP1; DHX58; IFI6; MT1A; LAP3; PARP12; IFIH1; HELZ2; DDX60; TRIM22; GBP1; RTP4; PARP14; PARP9; TIMM10; STAT2; DDX58; CTSL; JUP; SCO2; IL1RN; MAFB; LGALS3BP; BST2; FBXO6; NTNG2; CDKN1C; STAT1; UBE2L6; CCR1; TRIM5; IFIT5; PARP10; IFITM1; MOV10; CEACAM1; BLVRA; TNFSF10; TOR1B; GPBAR1; IFI16; EPB41L3; WARS; TNFSF13B; SAMD4A; TDRD7; TYMP; DHRS9; ZC3HAV1; SHFL; TENT5A; CSRNP1; MYOF; TAP1; DRAP1; C1QA; TMEM140; MX2; SP110; SCARB2; TMEM123; IFI30; ABCA1; TRAFD1; RIN2; CDKN1A; TLR7; CD300C; ABI3; APOBEC3A; PHF11; C1QB; SLC27A3; SEPT4; GALM; LGALS9; RGL1; CX3CR1; ADAP2; PTGDS; AIM2; SP140; DUSP5; ADA2; NUB1; RRAS; TAP2; HAVCR2; MICB; TRIM21; IRF9; ADAR; TCN2; ZNFX1; TMEM268; ATF5; NAGK; TTYH3; OSBPL5; GRN; SIDT2; PSME2; SRC; ANKFY1; CYBB; C3AR1; LMO2; SMCO4; LILRB1; CSF1R; TAGLN; REC8; CYSLTR1; FFAR2; ASCL2; CST3; MARCO; SCIMP; RHBDF2; HMOX1; FRMD2; SHISA5; PLAC8; RBCK1; RNF31; RGS12; KIAA0319L; LHFPL2; TMEM62; TRIM26; IDH2; CD68; TRIM38; GLMP; MAD2L1BP; CNDP2; APOBEC3F; MYD88; GIMAP8; CAMK1; CD86; BTN3A1; PLAGL2; SLC3A2; SNTB1; ASPRV1; AP5B1; SRBD1; UBA7; CASP1; HK3; GADD45B; RNH1; NAGA; FLVCR2; FCN1; FCER1G; PCK2; ZFYVE26; SLC37A2; ACOT9; TICAM1; SUSD1; ADA; SERTAD1; SIL1; TNS3; SORT1; MT1F; DPYSL2; NRROS; RNF135; HLA-A; GORASP1; ALDH3B1; GNGT2; RAB8A; TTC38; RIPK3; PSME1; SIGLEC5; GNA15; NPC2; MS4A7; NAPA; OGFR; KCNMB1; SLC2A6; PRAM1; LYPD2"	"N"	"gene expression"	"up"	"3d vs 0d"	"time of vaccination"	"3"	"days"	"YF-Vax; Stamaril"	"VO:0000121; VO:0003139"	""	"Yellow fever virus 17D"	"11090"	""	""	""	""	"19047440"	"2008"	"https://www.ncbi.nlm.nih.gov/pubmed/19047440"	"Supplemental Document 1"	"https://www.ncbi.nlm.nih.gov/pmc/articles/PMC2605227/bin/jem.20082292_1.pdf"	""	"219"	"219"	"1"	"30"	"19047440_1_30"
